CreatedOn,ID,Text,User,Location,OriginalText,token,Target
2020-11-06 01:22:55,1324522617563348992,CEL TOKEN RAGING WILDFIRE,frank86883298,"Los Angeles, CA",CEL TOKEN RAGING WILDFIRE🔥🔥🔥🔥🔥🔥🔥🔥🔥🔥🔥🔥🔥🔥🔥🔥👨🏾‍🚀,cel token rage wildfire,1
2020-11-06 01:21:57,1324522377028489216, We tried to tell you Weve been telling you where this was headed for years Its now like a wildf ,CallieKhouri,Nashville/Los Angeles,@stuartpstevens We tried to tell you. We've been telling you where this was headed for years. It's now like a wildf… https://t.co/1YZnonZLsm,try tell tell head year like wildf,0
2020-11-06 01:21:49,1324522341884432385, TommyWildfireRich,Carney4real,"Evansville, IN","@JasonIsbell Tommy,Wildfire,Rich",tommywildfirerich,0
2020-11-06 01:20:11,1324521930314141696, He would love to go see a movie but his inability to lead has cause a pandemic to spread like wildf ,Bryan_Boggs,"Arlington, TX","@GretaThunberg He would love to go see a movie, but his inability to lead has cause a pandemic to spread like wildf… https://t.co/D7UMkTAVKp",would love go see movie inability lead cause pandemic spread like wildf,0
2020-11-06 01:19:58,1324521877168103426, They are busy on Facebook where lies and conspiracy theories about election fraud are being spread like wi ,project99cast,WV,@dpakman They are busy on Facebook where lies and conspiracy theories about election fraud are being spread like wi… https://t.co/N8FYcfe4uc,busy facebook lie conspiracy theory election fraud spread like wi,0
2020-11-06 01:19:48,1324521833933144065, John Mayer  Wildfire,ahmadzulhilmi,06-MY,@blondedocean John Mayer - Wildfire,john mayer wildfire,0
2020-11-06 01:18:36,1324521531750404098, Thank you for introducing chucklefucks to my vocab Will spread that one like wildfire and give credit where due,mindsculptornae,"Spartanburg, SC",@TappyToeClaws Thank you for introducing “chucklefucks” to my vocab. Will spread that one like wildfire and give credit where due.,thank introduce chucklefuck vocab spread one like wildfire give credit due,0
2020-11-06 01:17:26,1324521238698561537,A California man donated 25000 baseball cards to a 9yearold girl who lost her collection in a wildfireBy Marika ,deskspud,,"A California man donated 25,000 baseball cards to a 9-year-old girl who lost her collection in a wildfire
By Marika… https://t.co/MjyjG0vw3E",california man donate 25000 baseball card 9yearold girl lose collection wildfireby marika,0
2020-11-06 01:16:37,1324521032183652353,Wildfire Size Comparison  via ,nicolas96281374,,Wildfire Size Comparison https://t.co/2MkuHlBlRe via @YouTube,wildfire size comparison via,0
2020-11-06 01:15:56,1324520862918168577, Um Ralph NOT fact checking this president from Day 1 has brought us here Once the lie is unleashed ,RedSoxN8N,,"@RalphNader Um, Ralph, NOT fact checking this president from Day 1 has brought us here. Once the lie is unleashed,… https://t.co/PDAFxQoebG",um ralph fact check president day 1 bring lie unleashed,0
2020-11-06 01:15:32,1324520762288402432,Spreading like wildfire Facebook fights hate speech before Myanmar poll ,malaysiakini,Malaysia,'Spreading like wildfire': Facebook fights hate speech before Myanmar poll https://t.co/s2Q5zNNeDO,spread like wildfire facebook fight hate speech myanmar poll,0
2020-11-06 01:15:14,1324520683922219008, Hes Prettyboy DO You can check out his last album Wildfire,Salvv_,"Lagos, Nigeria",@44HBTL He's Prettyboy D-O. You can check out his last album Wildfire,prettyboy check last album wildfire,0
2020-11-06 01:13:59,1324520370146213888, Not two weeks ago you stopped a 3 alarm fire on MacArthur amp 35th that was yards from a gas station ,MeghanMacaluso,"Oakland, California",@OaklandFireCA Not two weeks ago you stopped a 3 alarm fire on MacArthur &amp; 35th that was yards from a gas station.… https://t.co/1qB5w3ygL9,two week ago stop 3 alarm fire macarthur amp 35th yard gas station,1
